Recipe Id,Step Count,Message,Active time,Passive time
vegetable_pulao,2,"Heat ghee in a deep pot, add whole spices and cumin seeds. Once they sizzle, add sliced onions and sauté until golden brown. [29]",480,-1
vegetable_pulao,3,Add ginger-garlic paste and cook for a minute. Add chopped tomatoes and cook until they soften. [29],300,-1
vegetable_pulao,4,Add the mixed vegetables and sauté for 2-3 minutes. Stir in the drained rice and sauté gently for 1-2 minutes. [28],240,-1
vegetable_pulao,5,"Pour in hot water or stock and salt. Bring to a boil, then reduce heat to low, cover tightly, and simmer for 15-20 minutes until water is absorbed.",1200,-1
vegetable_pulao,6,"Turn off the heat and let the pulao rest, covered, for 5-10 minutes before fluffing with a fork and serving.",-1,600
matar_pulao,1,"Rinse and soak the basmati rice for 20-25 minutes, then drain.",-1,1500
matar_pulao,2,"Heat ghee in a pot, add whole spices. Once fragrant, add sliced onions and sauté until deep golden brown. [31]",540,-1
matar_pulao,3,"Add ginger-garlic paste, sauté for a minute, then add mint leaves and sauté until wilted. [31]",180,-1
matar_pulao,4,"Stir in the green peas and drained rice, sautéing gently for 1-2 minutes.",120,-1
matar_pulao,5,"Pour in hot water and salt. Bring to a boil, then cover and simmer on low for 15-20 minutes. [31]",1200,-1
matar_pulao,6,"Rest for 5-10 minutes after cooking, then fluff gently and serve.",-1,600
kashmiri_pulao,1,"Rinse and soak the basmati rice for 30 minutes, then drain.",-1,1800
kashmiri_pulao,2,"In a pan, heat 2 tbsp of ghee and fry the cashews and almonds until golden, then fry the raisins until they puff up. Remove and set aside. [34]",300,-1
kashmiri_pulao,3,"In the same pan, add remaining ghee and whole spices, sautéing until aromatic. Add fennel and ginger powder and stir for a few seconds. [37]",180,-1
kashmiri_pulao,4,"Add the drained rice and sauté gently for 1-2 minutes. Pour in the water/milk mixture and salt, and bring to a boil. [34]",300,-1
kashmiri_pulao,5,"Add the saffron-infused milk, cover tightly, and simmer on low for 15-20 minutes until the rice is cooked. [34]",1200,-1
kashmiri_pulao,6,"Rest for 5-10 minutes, then fluff the rice and garnish with the fried nuts, raisins, and fresh pomegranate arils before serving. [34]",-1,600
kodi_pulao,1,"Prepare the fried onion paste and ginger-garlic-green chili paste. Wash and soak rice for 20 minutes, then drain. [39]",-1,1200
kodi_pulao,2,"Heat ghee in a pressure cooker, sauté whole spices, curry leaves, and shallots. [39]",300,-1
kodi_pulao,3,"Add the chili paste and sauté. Add the fried onion paste, then the whisked yogurt and mix well. [39]",300,-1
kodi_pulao,4,"Add chicken and salt, cover and simmer for 15 minutes. [39]",900,-1
kodi_pulao,5,Stir in herbs and garam masala. Pour in coconut milk and water and bring to a rolling boil. [39],300,-1
kodi_pulao,6,"Add the drained rice, cashews, and a final tbsp of ghee. Pressure cook for 2 whistles and let the pressure release naturally. [39]",900,-1
kodi_pulao,7,Let the pulao rest for 10 minutes before fluffing and serving.,-1,600
moong_dal_khichdi,1,"Rinse rice and moong dal together. Soak in water for at least 30 minutes, then drain. [46]",-1,1800
moong_dal_khichdi,2,"Heat ghee in a pressure cooker. Add cumin seeds. Once they splutter, add chopped onion and sauté until translucent. [46]",360,-1
moong_dal_khichdi,3,"Add chopped ginger and green chili, then chopped tomatoes and cook until they soften. [46]",300,-1
moong_dal_khichdi,4,"Add turmeric powder, then the drained rice and dal mixture. Sauté for one minute. [46]",120,-1
moong_dal_khichdi,5,Pour in 4 cups of water and salt. Seal the cooker and pressure cook for 7-8 whistles. Let the pressure release naturally. [46],1500,-1
moong_dal_khichdi,6,Stir the cooked khichdi and serve hot with a dollop of ghee.,60,-1
dal_tadka,1,"Thoroughly rinse the lentils. In a pressure cooker, combine lentils, onions, tomatoes, green chilies, ginger, water, turmeric, and a pinch of asafoetida. Pressure cook for 7-8 whistles until creamy. [7]",1200,-1
dal_tadka,2,"Optional: To achieve a smoky flavor, heat a piece of charcoal until red hot, place it in a small bowl on the dal, pour ghee over it, and cover the pot for 1-2 minutes to infuse the smoke. [5]",120,-1
dal_tadka,3,"Stir salt, garam masala, and chopped coriander leaves into the cooked dal. [7]",60,-1
dal_tadka,4,"Prepare the tadka: Heat ghee in a small pan, add cumin seeds, then dried red chilies and garlic. Sauté until garlic is golden. Turn off heat, add asafoetida and red chili powder. [5]",180,-1
dal_tadka,5,Pour the sizzling tadka over the hot dal and serve immediately. [7],30,-1
dal_fry,1,Rinse and pressure cook the dal with water and turmeric for 2-3 whistles until very soft. Whisk lightly until smooth. [4],1200,-1
dal_fry,2,"Heat ghee in a pan, add cumin seeds. Once they sizzle, add onions and sauté until golden brown. [4]",360,-1
dal_fry,3,"Stir in ginger-garlic paste, then add tomatoes and salt. Cook until tomatoes are mushy and oil separates from the masala. [6]",300,-1
dal_fry,4,"Add spice powders (turmeric, chili, garam masala) and sauté for one minute. [4]",60,-1
dal_fry,5,Pour the cooked dal into the masala. Add hot water to adjust consistency and simmer for 5-7 minutes for flavors to absorb. [4],420,-1
dal_fry,6,Finish by stirring in crushed kasuri methi and chopped coriander leaves. [4],60,-1
dal_makhani,1,Rinse and soak urad dal and rajma together in water overnight. Drain before cooking. [3],-1,28800
dal_makhani,2,Pressure cook the soaked dal and rajma with 4 cups of water and salt for 30-40 minutes until completely soft. Lightly mash the lentils. [3],2400,-1
dal_makhani,3,"In a separate pan, heat ghee and 1 tbsp butter. Sauté onions until translucent, then add ginger-garlic paste. [3]",480,-1
dal_makhani,4,Pour in the tomato purée and cook for 10-15 minutes until the masala thickens and oil separates. Add red chili powder. [3],900,-1
dal_makhani,5,"Add the cooked dal mixture to the masala. Bring to a boil, then reduce heat to the lowest setting and simmer for a minimum of 30 minutes, stirring frequently. [3]",1800,-1
dal_makhani,6,"In the last 10 minutes, stir in the remaining butter, garam masala, and kasuri methi. Turn off the heat and stir in the heavy cream. [16]",600,-1
maa_ki_dal,1,Rinse and soak the urad dal and rajma overnight. Drain before use. [14],-1,28800
maa_ki_dal,2,"In a pressure cooker, heat oil and butter. Add cumin seeds, whole spices, chilies, onions, and ginger-garlic paste. Sauté for 2 minutes. [14]",300,-1
maa_ki_dal,3,"Add chili powder, turmeric, and fresh tomato pulp. Cook for 2 minutes. [14]",120,-1
maa_ki_dal,4,"Add garam masala, soaked dals, salt, and 1 cup of water. Pressure cook for 6 whistles. Let pressure release naturally. [14]",1500,-1
maa_ki_dal,5,"Open the cooker, add fresh cream, mix well, and lightly mash the dal. Simmer for 2-3 minutes and serve. [14]",180,-1
sambar,1,Pressure cook the toor dal with 2 cups of water and turmeric until completely soft and mushy. Mash thoroughly and set aside. [12],1200,-1
sambar,2,"Soak tamarind in hot water and extract the juice. In a large pot, boil the vegetables in 4 cups of water until tender but not mushy. [20]",900,-1
sambar,3,"To the cooked vegetables, add the tamarind extract, salt, and sambar powder. Simmer for 5 minutes. [19]",300,-1
sambar,4,"Add the mashed dal to the pot, stir, and bring to a gentle simmer for 2-3 minutes. Do not over-boil. [19]",180,-1
sambar,5,"Prepare the tempering: heat ghee/oil, pop mustard seeds, add red chilies, curry leaves, and asafoetida. Pour this sizzling tadka over the sambar. [19]",120,-1
rasam,1,"In a mortar or grinder, coarsely pound the peppercorns, cumin seeds, and garlic to make the fresh masala. [22]",120,-1
rasam,2,"In a bowl, squeeze the chopped tomatoes with the tamarind extract by hand to release their juices. [22]",120,-1
rasam,3,"Heat ghee/oil in a pot, pop mustard seeds, then add cumin, red chili, curry leaves, and hing for tempering. [22]",120,-1
rasam,4,"Pour in the tomato-tamarind mixture, add turmeric and salt, and boil for 5 minutes to cook off the raw tamarind smell. [22]",300,-1
rasam,5,Add 4 cups of water and bring to a rolling boil. Add the fresh masala paste and boil for just 2 more minutes until frothy. [22],300,-1
rasam,6,"Turn off the heat, stir in fresh coriander leaves, and serve hot. [22]",60,-1
mulligatawny_soup,1,"In a large pot, heat oil and bloom the garam masala for 30 seconds until fragrant. [30]",60,-1
mulligatawny_soup,2,"Add onion, carrots, celery, and apple. Cook for 7-8 minutes until softened. [30]",480,-1
mulligatawny_soup,3,Pour in the chicken broth and coconut milk. Add the rinsed red lentils and salt. Bring to a boil. [30],300,-1
mulligatawny_soup,4,"Reduce heat and simmer for 15 minutes, until the lentils are tender and have started to break down. [30]",900,-1
mulligatawny_soup,5,Optional: Use an immersion blender to partially purée the soup for a creamier texture. [30],120,-1
mulligatawny_soup,6,"Stir in the cooked chicken, fresh lime juice, and cilantro. Heat through, taste and adjust seasoning, and serve hot. [30]",300,-1
dalma,1,"In a pressure cooker, combine rinsed dal, all chopped vegetables, turmeric, grated ginger, bay leaf, salt, and 4 cups of water. [37]",300,-1
dalma,2,"Pressure cook for 1-2 whistles, then simmer on low for 3-4 minutes. Let pressure release naturally. [35]",1200,-1
dalma,3,"Prepare the tempering: heat mustard oil or ghee, add dried red chilies and panch phoran, and let the spices crackle. [36]",180,-1
dalma,4,Pour the tempering over the cooked dalma. Stir and simmer for 5-6 minutes to infuse flavors. [38],360,-1
dalma,5,"Turn off heat, sprinkle with roasted cumin-chili powder, and garnish with fresh coconut and coriander. [35]",60,-1
kadhi_pakora,1,Prepare pakora batter: Mix 1 cup besan with onions and spices. Rest for 20-30 minutes. Add a little water to form a thick batter. [41],-1,1800
kadhi_pakora,2,Deep fry spoonfuls of the batter until golden and crisp. Drain and set aside. [41],600,-1
kadhi_pakora,3,"Prepare Kadhi slurry: Whisk yogurt until smooth. Add ½ cup besan, turmeric, chili powder, and salt. Whisk to a smooth paste, then whisk in 3 cups of water. [41]",480,-1
kadhi_pakora,4,"In a large pot, heat mustard oil, add cumin and fenugreek seeds. Add chopped onions, ginger, garlic, and chilies and sauté until soft. [41]",420,-1
kadhi_pakora,5,"On low heat, slowly pour in the yogurt slurry, stirring constantly. Increase heat and bring to a boil, stirring frequently (about 15 mins). [41]",900,-1
kadhi_pakora,6,"Once boiling, reduce heat and simmer for 10-15 minutes. Add the fried pakoras and simmer for another 8-10 minutes. Serve hot. [41]",1500,-1
butter_chicken,1,"Make deep incisions in the chicken. In a large bowl, combine with salt, 1.5 tsp Kashmiri red chili powder, and lemon juice. Rub well and set aside for 30 minutes. [11]",-1,1800
butter_chicken,2,"Prepare the main marinade by whisking together thick yogurt, ginger-garlic paste, remaining chili powder, salt, garam masala, and mustard oil. Apply thoroughly to the chicken. Cover and refrigerate for at least 4 hours, or ideally overnight. [10]",-1,14400
butter_chicken,3,"Preheat oven to 200°C (400°F). Skewer and bake chicken for 15-20 minutes, basting with butter, until cooked and lightly charred. Alternatively, pan-sear until cooked. [10]",1200,-1
butter_chicken,4,"In a large pan, heat 2 tbsp butter and 1 tbsp oil. Add whole spices and sauté until fragrant. [11]",120,-1
butter_chicken,5,"Add ginger-garlic paste, sauté for a minute. Add tomato puree, chili powder, and salt. Cook for 15-20 minutes until thickened. [4]",1200,-1
butter_chicken,6,"Cool the tomato mixture slightly, blend until completely smooth, and then strain through a fine-mesh sieve back into the pan for a velvety texture. [10]",600,-1
butter_chicken,7,"Reheat gravy on low. Stir in sugar/honey, cooked chicken, remaining 2 tbsp butter, and fresh cream. Add crushed kasuri methi and simmer gently for 5-7 minutes. Do not boil. [9]",420,-1
chicken_tikka_masala,1,"Combine all marinade ingredients (yogurt, 1 tbsp ginger-garlic paste, spices, kasuri methi, lemon juice, oil, salt) with chicken. Cover and refrigerate for at least 8 hours. [15]",-1,28800
chicken_tikka_masala,2,"Grill the chicken. Oven: Bake at 240°C (460°F) for 18-20 mins, turning once, then broil for 2 mins. Skillet: Pan-sear for 3-4 mins per side until charred. [15]",1200,-1
chicken_tikka_masala,3,Heat oil/ghee. Sauté onions until deep golden brown. This is crucial for flavor. [15],600,-1
chicken_tikka_masala,4,"Add remaining ginger-garlic paste. Lower heat, add powdered spices, stir for 30 seconds. [15]",90,-1
chicken_tikka_masala,5,Immediately add tomato puree. Cook until masala thickens and oil separates. [15],600,-1
chicken_tikka_masala,6,"Pour in 1 cup hot water, cover, and simmer on low for 10-12 minutes. [15]",720,-1
chicken_tikka_masala,7,Stir in sugar and cream. Add grilled chicken and crushed kasuri methi. Simmer for 2-3 minutes. [15],180,-1
tandoori_chicken,1,Pat chicken dry. Make 3-4 deep slits down to the bone on each piece. [16],300,-1
tandoori_chicken,2,"Apply first marinade: lemon juice, 1 tsp chili powder, and salt. Rub into slits. Let rest for 20-30 minutes.",-1,1800
tandoori_chicken,3,Prepare second marinade by whisking yogurt with all remaining spices and mustard oil. Massage this thick paste into the chicken. [16],600,-1
tandoori_chicken,4,"Cover and refrigerate for at least 6 hours, or ideally overnight. [16]",-1,21600
tandoori_chicken,5,"Oven: Bake at 240°C (470°F) on a greased wire rack for 12-15 mins per side, basting with butter. Broil for 3-4 mins to char. [16]",1800,-1
tandoori_chicken,6,Stovetop: Cook in a hot skillet with oil for 4-5 mins per side until cooked through and charred. [16],600,-1
tandoori_chicken,7,Optional: Infuse smoky flavor using the dhungar method with a hot coal and ghee for 5-7 minutes. [16],420,-1
rogan_josh,1,"Pour 1 cup of boiling water over dry mawal flowers and let steep for 30 minutes. Strain, pressing the flowers to extract all color. Reserve the red liquid. [17]",-1,1800
rogan_josh,2,"Slowly fry sliced onions until golden brown, then cool and grind to a fine paste. [17]",900,-1
rogan_josh,3,"Boil mutton in 5 cups of water, skimming off scum. Add salt and garlic paste. Boil until half-cooked. [17]",1800,-1
rogan_josh,4,Remove meat and set aside. Strain the stock into a clean pan. [17],120,-1
rogan_josh,5,"In a heavy pot, heat ghee and fry whole spices until fragrant. [17]",180,-1
rogan_josh,6,"Bring reserved stock to a boil. Add the half-cooked meat, turmeric, fried onion paste, and the infused ghee. Boil for 10 minutes. [17]",600,-1
rogan_josh,7,"Stir in red chili powder. Reduce heat to low, cover, and simmer for 1-1.5 hours until meat is completely tender. [17]",5400,-1
rogan_josh,8,"Stir in the mawal extract, saffron water, and pepper powder. Boil for one minute. The gravy should have a layer of red ghee (rogan) on top. [17]",120,-1
mutton_korma,1,"Prepare Birista: Heat 1.5 cups oil and deep-fry sliced onions on medium flame for 10-14 mins until uniform golden brown. Drain and cool until crisp, then crush. Reserve the frying oil. [5]",1500,-1
mutton_korma,2,"In a heavy pot, combine mutton with yogurt, ginger-garlic paste, spice powders, salt, whole spices, crushed birista, and 5-6 tbsp of the reserved onion oil. Mix thoroughly. Cover and marinate overnight. [5]",-1,28800
mutton_korma,3,"The 'Bhunai': Bring marinated meat to room temp. Place pot on medium flame and braise (bhuno) for 10-15 mins, stirring as moisture releases and the mixture browns. [5]",900,-1
mutton_korma,4,"Add 1 cup hot water, bring to a simmer. Reduce heat to lowest, cover, and slow cook for 1.5 to 2 hours until meat is exceptionally tender. Add splashes of hot water only if necessary. [5]",7200,-1
mutton_korma,5,"Once tender and oil has separated, add ginger juliennes, finishing spice powders, kewra water, and ghee. Stir and simmer for 7-8 mins. Rest for 10-20 mins before serving. [5]",480,-1
nihari,1,"Prepare Nihari Masala: Dry roast whole spices (star anise, nutmeg, cinnamon, cardamom, etc.) for 4 mins. Cool and grind to a fine powder. Mix with powdered spices (dry ginger, chili, turmeric). [7]",360,-1
nihari,2,"Marinate meat with 2 tbsp each of ginger/garlic paste, 1 tsp salt, and 1 tbsp of Nihari masala. Rest for 30 minutes. [7]",-1,1800
nihari,3,"Heat oil/ghee in a large, heavy-bottomed pot. Fry the marinated meat for 5-8 minutes until it changes color. [7]",480,-1
nihari,4,"Add 3 tbsp of Nihari masala and cook for 5 more minutes. Pour in 2 litres of boiling water, add salt, cover, and simmer on the lowest heat for 6-8 hours. Do not stir. [7]",21600,-1
nihari,5,"After 4-5 hours, a layer of red oil (rogan) will float to the top. Carefully skim this off and set aside. [7]",180,-1
nihari,6,"Make a slurry with the whole wheat flour and 1 cup of warm water. Slowly pour this into the stew, stirring gently. Simmer for another hour to thicken the gravy. [7]",3600,-1
nihari,7,"Turn off heat. Sprinkle remaining masala and lemon juice. To serve, ladle into bowls and pour the reserved rogan over the top. Garnish with ginger juliennes and cilantro. [7]",120,-1
paya,1,"Crucial Step: Thoroughly clean the trotters. Singe any hair, then scrub with wheat flour and rinse well under running water. [28]",600,-1
paya,2,"In a pressure cooker, combine trotters, 1-2 litres water, broth onion, ginger, garlic, whole spices, and 1 tsp salt. Pressure cook for 45-60 minutes until meat is very tender. [27, 29]",3600,-1
paya,3,"In a separate pan, heat ghee and sauté the diced onion until golden brown. [26]",480,-1
paya,4,"Add ginger-garlic paste, then powdered spices. Add whisked yogurt and cook, stirring, until oil separates. [26]",420,-1
paya,5,"Strain the cooked trotters, reserving the broth. Add trotters to the masala, mix well, then pour in the reserved broth. Bring to a boil and simmer for 30-45 minutes. [28]",2700,-1
paya,6,"Add garam masala and cilantro, and simmer for a final 10 minutes. Serve hot with naan, garnished with ginger, chilies, and lemon. [27]",600,-1
keema_matar,1,Heat ghee/oil in a pan. Sauté onion for 6 minutes until softened. [32],360,-1
keema_matar,2,"Increase heat, add ginger, garlic, and chilies. Sauté for 30-60 seconds. [32]",60,-1
keema_matar,3,"Add minced meat and cook, breaking up lumps, for 5 minutes until no longer pink. [32]",300,-1
keema_matar,4,Stir in all powdered spices and bay leaf. Cook for one minute. Add tomatoes and salt. [32],120,-1
keema_matar,5,"Reduce heat, cover, and simmer for 8-10 minutes. [32]",600,-1
keema_matar,6,Stir in thawed green peas and simmer for another 3-4 minutes. [32],240,-1
keema_matar,7,Remove from heat. Stir in lemon juice and fresh cilantro. Serve hot with roti or naan. [32],60,-1
laal_maas,1,De-seed and soak the Mathania chilies in hot water for at least 30 minutes. Grind to a smooth paste. [35],-1,1800
laal_maas,2,Marinate the mutton with ginger-garlic paste for at least 1 hour. [35],-1,3600
laal_maas,3,"Heat ghee, splutter whole spices. Add onions and sauté until golden and caramelized. [35]",600,-1
laal_maas,4,Add the marinated mutton and sear on high heat for 5-10 minutes until well-browned. [36],600,-1
laal_maas,5,Add the Mathania chili paste and salt. Sauté for 8-10 minutes to cook out the raw flavor. [35],600,-1
laal_maas,6,"Whisk yogurt with powdered spices and mustard oil. Lower the heat and slowly add this mixture, stirring constantly to prevent curdling. Cook for 5-7 minutes until oil separates. [35]",420,-1
laal_maas,7,"Add 2 cups hot water, bring to a boil, then cover and simmer on low for 1-1.5 hours until meat is tender and a red oil (rogan) floats on top. [36]",5400,-1
chingri_malai_curry,1,"Marinate prawns with turmeric and salt. Prepare a smooth paste of onion, ginger, garlic, green chilies, and grated coconut. [38]",300,-1
chingri_malai_curry,2,Heat 2 tbsp mustard oil. Fry prawns for just one minute on each side until opaque. Set aside. [38],120,-1
chingri_malai_curry,3,"In remaining oil, temper whole spices until fragrant. [38]",30,-1
chingri_malai_curry,4,Add the blended paste and fry on medium heat for 5-7 minutes until well-cooked. [38],420,-1
chingri_malai_curry,5,"Stir in chili powder, sugar, and salt. Pour in coconut milk and 100ml water. Bring to a simmer. [38]",300,-1
chingri_malai_curry,6,Add the seared prawns and cook for a final 5 minutes. Do not overcook. Garnish and serve with rice. [38],300,-1
daab_chingri,1,Carefully cut an opening at the top of the coconut. Reserve the water. Scrape out the tender flesh and grind it to a paste. [39],600,-1
daab_chingri,2,"Marinate prawns with salt and turmeric. In a pan, lightly fry the prawns. In the same oil, cook onion paste, ginger-garlic paste, mustard paste, coconut flesh paste, and spices to form a masala. [40]",600,-1
daab_chingri,3,"Add coconut milk and some coconut water to the masala. Bring to a simmer, then add the prawns and chilies and cook for 2-3 minutes. [39]",180,-1
daab_chingri,4,Pour the entire prawn and gravy mixture into the hollowed coconut shell. [40],120,-1
daab_chingri,5,Place the coconut lid back on and seal the seam completely with wheat dough to trap the steam. [39],300,-1
daab_chingri,6,"Cook the sealed coconut by either pressure cooking for 15-20 mins (3 whistles) or baking in a preheated 200°C oven for 25-30 mins. [39, 41]",1800,-1
daab_chingri,7,Carefully break the seal and serve directly from the coconut shell. [39],60,-1
kosha_mangsho,1,"In a large bowl, marinate the mutton with yogurt, ginger-garlic-chili paste, crushed fried onions, all powdered spices, sugar, and salt. Marinate overnight for best results. [42]",-1,18000
kosha_mangsho,2,Heat oil/ghee in a heavy pot. Fry potato halves until golden brown and set aside. [42],480,-1
kosha_mangsho,3,"In the same oil, temper whole spices until fragrant. [42]",60,-1
kosha_mangsho,4,The 'Kosha' Process: Add the marinated meat to the pot. Stir continuously on medium-high heat for 10-15 minutes as the meat sears and releases moisture. [6],900,-1
kosha_mangsho,5,"Lower heat to the absolute minimum, cover tightly, and slow-cook for 1.5 to 2 hours. Do not add water. Stir every 20-25 minutes to prevent sticking. [6]",7200,-1
kosha_mangsho,6,Add the fried potatoes about 45 minutes before the meat is fully cooked. [6],2700,-1
kosha_mangsho,7,"Continue cooking until mutton is fork-tender and the gravy is a very thick, dark brown masala. The oil should have completely separated. Rest for 15 minutes before serving. [42]",900,-1
shorshe_ilish,1,Crucial Step: Soak black and yellow mustard seeds (and poppy seeds) in warm water for at least 30 minutes. [46],-1,1800
shorshe_ilish,2,"Drain seeds. Grind with 2-3 green chilies, a pinch of salt, and optional coconut to a very smooth paste. Do not over-grind. [46]",300,-1
shorshe_ilish,3,Marinate Hilsa with turmeric and salt. Heat mustard oil and fry fish for only 1-2 minutes per side to firm up the exterior. Set aside. [46],180,-1
shorshe_ilish,4,"In the same oil, temper with kalonji and slit green chilies. Lower heat, add mustard paste, and cook for only 1-2 minutes. Do not overcook. [46]",120,-1
shorshe_ilish,5,"Add turmeric, then 1.5 cups warm water. Simmer for 5-6 minutes. [46]",360,-1
shorshe_ilish,6,Gently place fish in the gravy. Cover and cook on low for 5-7 minutes until oil separates. Drizzle with 1 tsp raw mustard oil before serving with rice. [46],420,-1
chettinad_chicken,1,"Optional: Marinate chicken with ginger-garlic paste, curd, salt, and sambar powder for one hour. [52]",-1,3600
chettinad_chicken,2,Grind ingredients for Masala Paste 1 and Masala Paste 2 separately into two smooth pastes. [52],480,-1
chettinad_chicken,3,"Heat oil, sizzle tempering spices. Add minced onions and sauté until transparent. Add minced garlic, then chopped tomatoes and cook until mushy. [52]",420,-1
chettinad_chicken,4,Add Masala Paste 1 and sauté until oil separates. [52],300,-1
chettinad_chicken,5,Add chicken and mix well. Cover and cook on low for 10-15 minutes until almost cooked through. [52],900,-1
chettinad_chicken,6,"Add Masala Paste 2, mix well, and cook for another 5 minutes until the oil separates again and the gravy is thick. [52]",300,-1
chicken_65,1,"Combine chicken with all marination ingredients (egg, flours, ginger-garlic, spices, salt). Mix well to coat. Refrigerate for 15-20 minutes. [53]",-1,1200
chicken_65,2,Heat oil and deep-fry the marinated chicken pieces on medium flame for 10-15 minutes until golden and cooked through. Drain and set aside. [53],900,-1
chicken_65,3,"In a separate pan, heat 2-3 tbsp oil. Sauté crushed ginger, garlic, green chilies, and curry leaves until crisp. [53]",180,-1
chicken_65,4,"Lower heat, add beaten yogurt, salt, chili powder, and optional food color. Stir into a smooth sauce. [53]",120,-1
chicken_65,5,Add the fried chicken to the sauce. Toss well and cook for 5-10 minutes until the sauce thickens and clings to the chicken. [53],600,-1
chicken_65,6,"Garnish with coriander, lemon juice, and serve with onion rings. [53]",60,-1
haleem,1,Wash and soak broken wheat and all lentils together overnight. [56],-1,28800
haleem,2,"Pressure cook mutton with ginger-garlic paste, turmeric, and salt until extremely tender. Separate meat from bones, shred finely, and reserve stock. [56]",3600,-1
haleem,3,Cook the soaked grains and lentils until completely soft and mushy. Blend into a smooth paste using a hand blender. [56],2400,-1
haleem,4,"In a large pot, heat ghee, sauté whole spices, then add the shredded meat and powdered spices. Cook for 2-3 minutes. [56]",180,-1
haleem,5,"Add the grain-lentil paste to the pot, mixing thoroughly. Pour in reserved meat stock to achieve a porridge-like consistency. [56]",300,-1
