Recipe Id,Step Count,Message,Active time,Passive time
haleem,6,"Simmer on very low heat for at least 45-60 minutes, stirring frequently to prevent sticking. [56]",3600,-1
haleem,7,"Serve hot, garnished generously with fried onions, fresh herbs, lemon juice, and cashews. [56]",60,-1
jalfrezi,1,"Marinate chicken with lemon juice, salt, pepper, and chili powder for 15-20 minutes. [58]",-1,1200
jalfrezi,2,"Heat oil, sauté chopped onions until light brown. Add ginger-garlic paste. [58]",420,-1
jalfrezi,3,"Add marinated chicken and stir-fry until pale. Add powdered spices and salt, stir-fry for one minute. [58]",300,-1
jalfrezi,4,"Pour in tomato puree, cook until oil separates. Add ¼ cup hot water, cover, and cook until chicken is tender. [58]",600,-1
jalfrezi,5,"In a separate pan, heat oil on high and stir-fry diced onions and bell peppers for 3-4 minutes until crisp-tender and charred. [58]",240,-1
jalfrezi,6,Add the stir-fried vegetables and kasuri methi to the chicken. Toss and cook for 1-2 minutes. The sauce should be thick. [58],120,-1
meen_moilee,1,Lightly marinate fish steaks with salt and turmeric for 15 minutes. [1],-1,900
meen_moilee,2,"Heat coconut oil. Sauté ginger, curry leaves, then onion, garlic, and green chilies until onions are soft. [59]",300,-1
meen_moilee,3,"Add tomatoes and salt, cook until mushy. Add turmeric and chili powder. [59]",300,-1
meen_moilee,4,"Pour in 1 cup water, bring to boil. Gently place fish steaks in and simmer for 5 minutes. [59]",300,-1
meen_moilee,5,Reduce flame to lowest. Pour in coconut milk. Do not boil. [59],60,-1
meen_moilee,6,Add lime juice and vinegar. Simmer very gently for 5 minutes. Let it rest for 20 minutes before serving with appam. [1],1500,-1
sorpotel,1,"Soak 25 deseeded Kashmiri chilies in vinegar for 4 hours. Grind with 40 garlic cloves, ginger, and whole spices to a very fine paste. [63]",-1,14400
sorpotel,2,"Boil large chunks of pork and liver with aromatics for 30-40 minutes until par-cooked. Cool, then finely dice all meat and liver into tiny, uniform cubes. Reserve the stock. [63]",2400,-1
sorpotel,3,"Heat oil. Fry diced fatty pork until light brown, remove and add to stock. Fry lean pork, remove and add to stock. Fry liver briefly, remove and add to stock. [63]",1200,-1
sorpotel,4,"In the remaining fat, sauté onions until soft. Add the ground masala and cook for 10 minutes until oil separates. [63]",600,-1
sorpotel,5,"Add jaggery, then all the fried meat and the entire stock. Mix well and simmer for 10 minutes. [63]",600,-1
sorpotel,6,"Add 1.5 cups warm water and tamarind water. Bring to a boil, then cover and simmer on low for 20-25 minutes. Adjust seasoning. [63]",1500,-1
sorpotel,7,"Cool completely. For best taste, refrigerate for at least two days before reheating and eating. [63]",-1,172800
kerala_beef_fry,1,"In a pressure cooker, combine beef with pressure cooking spices, half the onions, chilies, and curry leaves. Add ½ cup water and pressure cook until tender (3-4 whistles plus 20 mins on low). [67]",1500,-1
kerala_beef_fry,2,"Heat coconut oil in a thick-bottomed pan. Sauté remaining onions, coconut slices, and curry leaves until onions are golden and coconut is crisp. [67]",600,-1
kerala_beef_fry,3,Add ginger-garlic paste and sauté until fragrant. [67],120,-1
kerala_beef_fry,4,"Add the cooked beef with all its liquid to the pan. Cook on medium-high heat, stirring, until all liquid has evaporated. [67]",900,-1
kerala_beef_fry,5,"Stir in the garam masala and crushed black pepper. Reduce flame to low and pan-roast for another 15-20 minutes, stirring occasionally, until the beef is dry and dark brown. [67]",1200,-1
mutton_dhansak,1,Wash and soak all four types of dal for 30 minutes. [71],-1,1800
mutton_dhansak,2,"In a pressure cooker, combine the soaked dals, all the chopped vegetables (pumpkin, brinjal, potatoes, tomatoes, methi), half the onions, half the ginger-garlic paste, turmeric, and water. Cook until everything is very soft. [70]",1500,-1
mutton_dhansak,3,"In a separate pot, heat ghee and temper whole spices. Sauté the remaining onions until golden. Add the remaining ginger-garlic paste, then the mutton pieces and brown them. [71]",900,-1
mutton_dhansak,4,"Add the dhansak masala, chili powder, and salt. Cook until fragrant. Add enough water to cook the mutton until it is tender. [70]",1800,-1
mutton_dhansak,5,"Blend the cooked dal and vegetable mixture to a smooth, thick puree. [70]",300,-1
mutton_dhansak,6,"Pour the dal puree into the pot with the cooked mutton. Mix well. In a small bowl, mix tamarind paste, jaggery, and lime juice (the 'Doru'). Add this to the stew and simmer for a final 10 minutes. [71]",600,-1
aloo_gobi,1,"Rinse cauliflower, chop into florets, and soak in hot, salted water for 15-20 minutes, then drain. [21] Peel and cube potatoes, placing them in water to prevent browning. [22]",-1,900
aloo_gobi,2,"Heat oil in a heavy pan. Drain and add the potatoes, sautéing for 2-3 minutes. Cover and cook on low-medium heat until half-done. [22]",660,-1
aloo_gobi,3,"Push potatoes aside, add cumin seeds to the oil. When they sizzle, add ginger and garlic and sauté until fragrant. [22] Add onions and cook until translucent. [22]",300,-1
aloo_gobi,4,"Add cauliflower and green chili, stir-frying for 3 minutes. [22] Add all spice powders except garam masala. [22]",240,-1
aloo_gobi,5,"Add tomatoes, stir, cover, and cook on low for 10-15 minutes until vegetables are tender but not mushy, avoiding extra water. [22]",900,-1
aloo_gobi,6,Add garam masala and salt (added at the end to prevent mushiness). Garnish with coriander and lemon juice. [22],120,-1
chole_masala,1,"Rinse and soak 1 cup of chickpeas in water overnight. [5] Drain, then pressure cook with 2.5-3 cups fresh water, salt, and either dried amla or a tea bag for 15-18 minutes until very soft. [5] Reserve the cooking liquid. [5]",-1,29880
chole_masala,2,"To make fresh masala, dry roast coriander seeds, cumin seeds, fennel seeds, black cardamoms, cinnamon, peppercorns, cloves, bay leaf, dried pomegranate seeds (anardana), and dry red chilies until aromatic. [5] Cool and grind to a fine powder. [2]",600,-1
chole_masala,3,"Heat ghee, sauté onions until golden. [27] Add ginger-garlic paste, then tomatoes, and cook until pulpy and oil separates. [5]",600,-1
chole_masala,4,"On low heat, add the fresh chole masala powder, red chili powder, and turmeric. Sauté for one minute. [5]",60,-1
chole_masala,5,"Add the cooked chickpeas and 1 to 1.25 cups of the reserved stock. [5] Bring to a boil, then cover and simmer for 10-15 minutes, mashing a few chickpeas to thicken the gravy. [25]",900,-1
chole_masala,6,Finish with garam masala and crushed kasuri methi. [5],60,-1
dum_aloo,1,"Wash, par-boil, and peel the baby potatoes. Prick each potato with a fork. [28] Fry them in oil until golden brown and slightly crisp, then set aside. [30]",600,-1
dum_aloo,2,"Blend boiled onions, chopped tomatoes, and cashews into a very smooth paste. [28]",300,-1
dum_aloo,3,"Heat oil, add ginger-garlic paste, then the onion-tomato-cashew paste. Cook for 7-8 minutes until thickened. [30]",540,-1
dum_aloo,4,"On low heat, add spice powders and sauté until oil separates. Turn off the heat and vigorously stir in the whisked yogurt to prevent curdling. [30]",180,-1
dum_aloo,5,"Turn heat back to low. Add the fried potatoes, hot water, salt, and sugar. [28] Bring to a simmer, then cover with a tight lid and 'dum' cook on the lowest heat for 6-7 minutes. [30]",420,-1
dum_aloo,6,Finish by stirring in crushed kasuri methi. [30],60,-1
kadai_paneer,1,"Prepare Kadai Masala: Dry roast coriander seeds, cumin seeds, fennel seeds, dry red chilies, and black peppercorns until fragrant. [20] Cool and grind to a coarse powder. [20]",300,-1
kadai_paneer,2,"Heat oil in a kadai on high. Stir-fry onion petals and capsicum chunks for 2-3 minutes until blistered but still crisp. Add paneer cubes, toss for a minute, then remove and set aside. [20]",300,-1
kadai_paneer,3,"In the same kadai, heat more oil. Sauté cumin, ginger, and garlic. Add finely chopped onions and cook until golden. [20]",420,-1
kadai_paneer,4,Add spice powders and 1 tbsp of the fresh Kadai Masala. Sauté for 30 seconds. Add chopped tomatoes and cook until soft and oil separates. [20],480,-1
kadai_paneer,5,Add the stir-fried paneer and vegetables back to the kadai. Toss to coat. Add ½ cup hot water for a gravy and simmer for 2-3 minutes. [20],180,-1
kadai_paneer,6,Finish with cream (if using) and crushed kasuri methi. [20],60,-1
malai_kofta,1,"For the gravy, sauté whole spices, onions, tomatoes, and cashews in oil until soft. Cool completely, then blend to a super-smooth puree. Strain if necessary. [29]",1500,-1
malai_kofta,2,"For the koftas, combine crumbled paneer, potato, corn starch, and spices to form a smooth dough. Shape into 8-10 crack-free balls. [29]",600,-1
malai_kofta,3,Deep-fry the koftas in medium-hot oil until evenly golden brown and crisp. Drain and set aside. [29],900,-1
malai_kofta,4,"Reheat the gravy base in a pan. Sauté ginger-garlic paste and spice powders, then add the puree. Cook for 3-4 minutes. [29]",300,-1
malai_kofta,5,"Add water, salt, and sugar. Simmer for 10-14 minutes until the gravy thickens. [29]",840,-1
malai_kofta,6,"Stir in kasuri methi and heavy cream on low heat. To serve, pour the warm gravy into a dish and gently place the koftas on top. Do not simmer the koftas in the gravy. [29]",120,-1
palak_paneer,1,"Bring water to a boil, turn off heat, and add spinach leaves for exactly one minute. [34] Immediately transfer to an ice bath to lock in the color. [34]",300,-1
palak_paneer,2,"Drain the cooled spinach, squeezing out excess water. Blend it with ginger, garlic, and green chilies to a smooth puree. [34]",300,-1
palak_paneer,3,"Heat oil, splutter cumin seeds. Sauté onions until golden, then add garlic and cook until fragrant. [34]",420,-1
palak_paneer,4,Add tomatoes and cook until soft and mushy. [34],300,-1
palak_paneer,5,"Pour in the spinach puree, water, and salt. Simmer for 6-7 minutes. [34]",420,-1
palak_paneer,6,"Add paneer cubes (raw or lightly fried) and garam masala. Cook for one minute, then stir in cream if using. [34]",120,-1
rajma,1,Rinse and soak 1 cup of rajma in ample water overnight (at least 8 hours). [25],-1,43200
rajma,2,"Drain, then pressure cook the soaked beans with 3 cups of fresh water and salt until completely soft. Reserve the cooking liquid. [25]",1800,-1
rajma,3,"Heat ghee, sauté whole spices, then add onions and cook until golden brown. [25]",420,-1
rajma,4,"Add ginger-garlic paste, then powdered spices. Add chopped tomatoes and cook until the ghee separates from the masala. [25]",480,-1
rajma,5,"Add the cooked rajma with its liquid to the masala. Cover and simmer for at least 15 minutes, mashing some beans to thicken the gravy. [25]",900,-1
rajma,6,"Finish with garam masala, crushed kasuri methi, and fresh coriander. [25]",120,-1
sarson_ka_saag_makki_di_roti,1,"For Saag: Thoroughly clean and chop all greens. [36] Pressure cook the greens with radish, onions, tomatoes, ginger, and garlic for 7-8 whistles until very soft. [36]",8700,-1
sarson_ka_saag_makki_di_roti,2,"Cool the mixture, then blend to a puree, adding 2 tbsp of maize flour during blending to thicken. [36]",300,-1
sarson_ka_saag_makki_di_roti,3,Simmer the puree on low heat for at least 25-30 minutes to cook the maize flour and develop flavors. [36],1800,-1
sarson_ka_saag_makki_di_roti,4,"For Roti: Combine 2 cups maize flour with salt and hot water. [39] Knead into a smooth, firm dough and let it rest for 10 minutes. [38]",-1,900
sarson_ka_saag_makki_di_roti,5,Shape the rotis by patting with hands or rolling between parchment paper. [40] Cook on a hot tawa with ghee until golden spots appear. [39],900,-1
sarson_ka_saag_makki_di_roti,6,"Temper the saag in batches before serving by frying chopped onions in ghee, then adding the saag and heating through. [36] Serve hot with the makki di roti, both topped with white butter. [36]",300,-1
gatte_ki_sabzi,1,"For Gatte: Make a firm dough with 1 cup besan, yogurt, spices, and ghee. Roll into thin logs. [11]",600,-1
gatte_ki_sabzi,2,"Boil the logs in water for 12-15 minutes until they float and develop bubbles. [11] Remove and cut into pieces. Crucially, reserve the cooking water. [11]",900,-1
gatte_ki_sabzi,3,"For Gravy: In a bowl, whisk ¾ cup yogurt with turmeric, chili, and coriander-cumin powders. [11]",240,-1
gatte_ki_sabzi,4,"Heat ghee, sauté spices, then onions until golden. Add ginger-garlic and tomato pulp. [11]",480,-1
gatte_ki_sabzi,5,"On lowest heat, slowly add the yogurt-masala paste, stirring constantly to prevent splitting. [11] Cook until ghee separates. [11]",180,-1
gatte_ki_sabzi,6,"Pour in 2 cups of the reserved gatta water. Bring to a boil, add the gatte, and simmer for 10-12 minutes. Finish with kasuri methi. [11]",720,-1
undhiyu,1,"Prepare Methi Muthias: Make a dough of chopped fenugreek leaves, gram flour, and spices. [47] Shape into ovals and deep-fry until golden. [47]",1500,-1
undhiyu,2,"Prepare Green Masala: Combine grated coconut, coriander, green garlic, sugar, and spices. [57]",600,-1
undhiyu,3,Prepare Vegetables: Peel and chop root vegetables into large chunks. [57] Slit baby potatoes and brinjals and stuff them with the green masala. [47],1200,-1
undhiyu,4,"In a pressure cooker, heat oil and temper with carom seeds. Layer the vegetables, starting with the beans and root vegetables at the bottom, and placing stuffed vegetables on top. [57]",300,-1
undhiyu,5,Pour a little masala water over the top and pressure cook for 2 whistles. [57] Let pressure release naturally. [57],900,-1
undhiyu,6,"Gently transfer to a wide pan, add the fried muthias, and simmer for a final 10 minutes to meld the flavors. [47]",600,-1
papaya_khar,1,"Peel and cube the raw papaya and optional potato. Dissolve baking soda in warm water to make the khar solution. [15, 16]",600,-1
papaya_khar,2,"Heat mustard oil until it just begins to smoke. Reduce heat and add panch phoron, letting it sizzle. [15]",180,-1
papaya_khar,3,"Add the papaya and potato cubes, salt, and stir-fry for 2-3 minutes. [16]",180,-1
papaya_khar,4,"Pour in the khar solution and another cup of hot water. [16] Bring to a boil, then cover and simmer for 15-20 minutes. [61]",1200,-1
papaya_khar,5,"The dish is ready when the vegetables are extremely tender. The final consistency should be soupy. Do not add turmeric, as it will react with the alkali and change color. [16]",60,-1
avial,1,"Prepare a coarse paste by grinding coconut, cumin seeds, and green chilies with a little water. [63]",300,-1
avial,2,"In a wide pan, first cook the harder vegetables (like yam, drumsticks) with turmeric and salt in 1 cup of water until half-cooked. [63]",900,-1
avial,3,"Add the softer vegetables (like plantain, gourd) and cook until all vegetables are tender but hold their shape. [63]",600,-1
avial,4,Stir in the ground coconut paste and simmer for 5-7 minutes. [63],420,-1
avial,5,"Reduce heat to low, add the whisked yogurt, and stir gently. Heat through for one minute but do not boil. [63]",120,-1
avial,6,Turn off the heat. Drizzle with raw coconut oil and scatter fresh curry leaves. Cover and let it rest for 5 minutes before serving. [63],-1,300
bhindi_masala,1,Wash and thoroughly pat dry the okra. [3] This is the most critical step to prevent slime. [3] Chop into ½-inch rounds. [3],300,-1
bhindi_masala,2,"Heat oil in a kadai. Fry the chopped okra on medium-high heat, stirring occasionally, until it is tender and no longer slimy. Remove from the pan and set aside. [3]",480,-1
bhindi_masala,3,"In the same oil, splutter cumin seeds. Sauté onions until translucent. Add ginger-garlic paste and cook for a minute. [3]",240,-1
bhindi_masala,4,Add tomatoes and cook until pulpy. Add spice powders and cook until aromatic. [3],240,-1
bhindi_masala,5,"Add the fried okra back to the pan, toss with the masala, and add amchur powder. [3] Simmer on low for 3 minutes for flavors to meld. Finish with garam masala and kasuri methi. [3]",180,-1
spicy_green_chutney,1,Thoroughly wash the cilantro and mint leaves. Ensure you only use mint leaves as the stems can be bitter. [36],180,-1
spicy_green_chutney,2,"Combine all ingredients, including the ice cubes, in a high-speed blender.",60,-1
spicy_green_chutney,3,"Blend to a smooth, fine paste. Add a teaspoon of extra chilled water only if needed to facilitate blending. The consistency should be a thick, spoonable paste.",360,-1
tamarind_chutney,1,Soak the tamarind block in hot water for at least 30 minutes.,-1,1800
tamarind_chutney,2,"Mash the soaked tamarind to separate the pulp from the fibers, then strain the mixture through a sieve into a saucepan, extracting all the pulp.",300,-1
tamarind_chutney,3,"Add jaggery and all spice powders to the tamarind pulp. Bring to a boil, stirring to dissolve the jaggery.",300,-1
tamarind_chutney,4,Reduce heat and simmer for 10-15 minutes until the chutney thickens. It will thicken more as it cools.,900,-1
dry_garlic_chutney,1,"On low-medium heat, dry roast peanuts, garlic, sesame seeds, and desiccated coconut separately until each is aromatic and lightly golden. [9]",600,-1
dry_garlic_chutney,2,Let all roasted ingredients cool completely.,-1,300
dry_garlic_chutney,3,"Combine all cooled ingredients in a grinder with chili powder and salt. Pulse in short bursts to create a coarse, dry powder.",180,-1
wet_garlic_chutney,1,Soak the dried red chilies in boiling water for 30 minutes to soften them.,-1,1800
wet_garlic_chutney,2,"Transfer the soaked chilies along with their water, garlic, lemon juice, and salt to a blender.",60,-1
wet_garlic_chutney,3,"Blend to a fine, smooth paste, adding a little more water only if necessary.",300,-1
aloo_tikki_chaat,1,"Boil potatoes until fork-tender but not mushy. Cool completely, then refrigerate uncovered for at least 4-5 hours or overnight to dry them out. [2]",-1,14400
aloo_tikki_chaat,2,"Peel and grate the cold potatoes. Add cilantro, ginger, green chilies, chaat masala, and cornstarch. Mix gently until just combined, do not overmix. [2]",300,-1
aloo_tikki_chaat,3,"Add salt just before frying. Shape the mixture into smooth, round patties about 1-2 inches thick. [13]",480,-1
aloo_tikki_chaat,4,"Heat oil in a skillet over medium heat. Shallow fry the tikkis for 4-6 minutes per side, until deep golden brown and crisp. [2]",1800,-1
aloo_tikki_chaat,5,"Place hot tikkis on a plate, top with chilled yogurt, sweet tamarind chutney, and spicy green chutney. Garnish with onions, sev, and a sprinkle of chaat masala. [13]",180,-1
bhel_puri,1,Dry roast the puffed rice in a large pan on low heat for 4-5 minutes until very crisp. Let it cool completely. [5],300,-1
bhel_puri,2,"In a large mixing bowl, combine the cooled puffed rice, crushed papdi, peanuts, potato, onion, tomato, and raw mango.",120,-1
bhel_puri,3,"Sprinkle with chaat masala and salt. Add the green, tamarind, and garlic chutneys to your taste, along with lemon juice.",60,-1
bhel_puri,4,Add the sev at the very end and mix everything swiftly with a large spoon for no more than 30 seconds. [5],30,-1
bhel_puri,5,Garnish with fresh cilantro and serve immediately.,30,-1
chole_bhature,1,"For Bhature: Knead a soft, smooth dough from flour, yogurt, baking soda, salt, sugar, and lukewarm water. Rest in a warm place for 2-4 hours. [20]",-1,7200
chole_bhature,2,For Chole: Pressure cook the overnight-soaked chickpeas with the tea bag/amla and salt for 20 minutes until very tender. [21],1200,-1
chole_bhature,3,"In a pan, heat ghee, sauté onion paste until golden brown, add ginger-garlic paste, then tomato puree and cook until oil separates. [21]",900,-1
chole_bhature,4,"Add chole masala and other spice powders. Add the boiled chickpeas with their water. Simmer for 20-30 minutes, mashing some chickpeas to thicken the gravy. [21]",1500,-1
chole_bhature,5,"While chole simmers, roll out the rested dough into ovals and deep-fry in hot oil. Press gently to help them puff up completely. [20]",900,-1
chole_bhature,6,Serve hot chole immediately with freshly fried bhature.,60,-1
dahi_vada,1,"Drain soaked lentils. Grind with ginger and green chilies to a smooth, thick paste, using minimal chilled water. [26]",480,-1
dahi_vada,2,Transfer batter to a bowl and beat with your hand or a whisk for 3-5 minutes until light and aerated. The batter should float when a drop is placed in water. [29],300,-1
dahi_vada,3,Deep fry lemon-sized portions of the batter in medium-hot oil until golden brown. [28],900,-1
dahi_vada,4,"Soak the hot, fried vadas in a bowl of hot water with salt and hing for 20-30 minutes. They will soften and swell. [28]",-1,1800
dahi_vada,5,Gently press each soaked vada between your palms to remove excess water and place in a serving dish. [26],300,-1
dahi_vada,6,Whisk chilled yogurt with powdered sugar and salt until smooth. Pour over the vadas. Refrigerate for at least 2 hours. [26],-1,7200
dahi_vada,7,"Serve chilled, drizzled with chutneys and sprinkled with roasted cumin and chili powder. [28]",120,-1
misal_pav,1,Pressure cook the sprouted moth beans with turmeric and salt for one whistle until soft but intact. [36],600,-1
misal_pav,2,"Prepare masala paste by sautéing onion, ginger, garlic, and dry coconut until golden, then grinding to a smooth paste with tomatoes. [36]",900,-1
misal_pav,3,"Heat oil, temper with mustard and cumin seeds. Add the masala paste and sauté until oil separates. Add misal masala and other spice powders. [36]",600,-1
misal_pav,4,"Add the cooked moth beans with their water, tamarind paste, and 4-5 cups of hot water to create the gravy. Boil and then simmer for 15 minutes for the oily layer (tari) to form. [36]",900,-1
misal_pav,5,"To serve, place the thick sprout curry (usal) in a bowl, pour the thin spicy gravy (kat) over it, top with farsan, chopped onion, and coriander. Serve with lemon and pav. [36]",180,-1
veg_momos,1,"Knead a firm, smooth dough from flour, salt, and warm water. Rest, covered, for at least 30 minutes. [39]",-1,1800
veg_momos,2,"Salt the chopped cabbage, let it sit for 15 minutes, then squeeze out all excess water thoroughly. [42]",-1,900
veg_momos,3,"Sauté ginger and garlic, then add onions, carrots, and the squeezed cabbage. Stir-fry on high heat for 2-3 minutes. Season with soy sauce, salt, and pepper. Cool completely. [39]",480,-1
veg_momos,4,"Roll out small, thin wrappers from the dough. Place a spoonful of filling, then fold and pleat to seal. [39]",900,-1
veg_momos,5,"Steam the momos in a greased steamer over boiling water for 10-12 minutes, until the wrapper is translucent and non-sticky. [39]",720,-1
chicken_momos,1,"Knead a firm, smooth dough from flour, salt, and warm water. Rest, covered, for at least 30 minutes. [39]",-1,1800
chicken_momos,2,"For the filling, combine raw chicken mince, spring onions, ginger, garlic, soy sauce, oil/butter, salt, and pepper. Mix thoroughly. [41]",480,-1
chicken_momos,3,"Roll out small, thin wrappers from the dough. Place a spoonful of the raw chicken filling, then fold and pleat to seal tightly. [39]",900,-1
chicken_momos,4,"Steam the momos in a greased steamer over boiling water for 12-15 minutes, until the wrapper is translucent and the filling is cooked through. [39]",900,-1
mixed_veg_pakora,1,"In a large bowl, combine the julienned vegetables with salt, ginger, and green chilies. Mix and let rest for 10 minutes to release moisture. [52]",-1,600
mixed_veg_pakora,2,"Add gram flour, rice flour, and all spices to the vegetables. Mix well without adding water initially. The vegetable moisture should form a thick, sticky mass. Add 1-2 tbsp water only if essential. [52]",240,-1
mixed_veg_pakora,3,"Heat oil to medium-high. Drop spoonfuls of the mixture into the oil, without overcrowding. [51]",300,-1
mixed_veg_pakora,4,"Fry for 3-5 minutes, turning, until deep golden brown and crispy. Drain on paper towels and serve hot with chutney. [51]",600,-1
golgappa,1,"For Puris: Knead a firm, elastic dough from semolina, flour, salt, and lukewarm water. Rest, covered, for 30 minutes. [63]",-1,1800
golgappa,2,"Roll the dough very thin and cut small discs. Deep-fry in medium-hot oil, nudging them to help them puff. Fry until golden and crisp. Cool completely. [64]",1200,-1
golgappa,3,"For Pani: Blend mint, cilantro, ginger, green chilies, and tamarind to a smooth paste. Strain the paste, add 4 cups of chilled water, roasted cumin powder, chaat masala, and black salt. [4]",600,-1
golgappa,4,"For Filling: Mix boiled, diced potatoes and chickpeas with salt and spices. [4]",180,-1
golgappa,5,"To serve, crack a hole in a puri, add the filling, dunk it in the pani, and eat immediately.",60,-1
pav_bhaji,1,"Pressure cook the mixed vegetables (except capsicum) with water and salt for 15 minutes until very soft. Lightly mash them, retaining the cooking water. [73]",900,-1
pav_bhaji,2,"In a large pan, heat 3 tbsp butter. Sauté onions until translucent, add ginger-garlic paste, then capsicum and cook for 3 minutes. [72]",480,-1
pav_bhaji,3,"Add tomatoes and cook until mushy. Add all spice powders, including the pav bhaji masala, and cook until butter separates. [73]",420,-1
pav_bhaji,4,"Add the mashed vegetables and their water to the pan. Using a potato masher, mash and mix everything together for 5-7 minutes until well combined. [73]",420,-1
pav_bhaji,5,"Simmer for 10 minutes, adding hot water to adjust consistency. Finish with lemon juice, more butter, and cilantro. [72]",600,-1
pav_bhaji,6,"Toast pav rolls on a tawa with butter and a pinch of pav bhaji masala. Serve hot with the bhaji, chopped onions, and a lemon wedge. [72]",300,-1
kanda_poha,1,"Rinse the thick poha in a colander under running water for a minute until soft. Drain completely and let it rest for 10-15 minutes. Add salt, sugar, and turmeric and toss gently. [81]",-1,900
kanda_poha,2,Heat oil in a pan. Fry peanuts until crunchy and set aside. [80],180,-1
